{
  "schemaVersion": "2.0",
  "id": "org.launcher.trusted-jvm-sample",
  "name": "Trusted Minecraft JVM Hook Example",
  "version": "0.30.6",
  "publisher": "Launcher",
  "description": "Signed trusted Java agent and classloader plugin (full JVM access)",
  "api": "1.0",
  "targets": [{"kind": "backend", "entrypoint": "trusted/agent.jar"}],
  "permissions": []
}
