{
  "schemaVersion": "2.0",
  "id": "ru.example.launcher.admin-dashboard",
  "name": "Admin Dashboard Example",
  "version": "0.1.0",
  "publisher": "Launcher Examples",
  "api": "1.0",
  "targets": [
    {
      "kind": "admin",
      "entrypoint": "admin/index.html"
    }
  ],
  "permissions": [
    "project:read",
    "ui:contribute"
  ],
  "admin": {
    "pages": [
      {
        "id": "main",
        "title": "Admin Dashboard Example"
      }
    ],
    "navigation": [
      {
        "id": "main-nav",
        "label": "Admin Dashboard Example",
        "pageId": "main"
      }
    ],
    "dashboardWidgets": [
      {
        "id": "summary",
        "title": "Admin Dashboard Example",
        "pageId": "main",
        "height": 280
      }
    ]
  }
}
