{
  "schemaVersion": "2.0",
  "id": "ru.example.launcher.backend-health",
  "name": "Backend Health Example",
  "version": "0.1.0",
  "publisher": "Launcher Examples",
  "api": "1.0",
  "targets": [
    {
      "kind": "backend",
      "entrypoint": "backend/bin/extension-backend"
    }
  ],
  "permissions": [
    "telemetry:write"
  ]
}
